{
  "apiVersion": "ckodex.org/stx/v1",
  "kind": "StxEvent",
  "sessionId": "urn:ckodex:session:demo-001",
  "sequence": 5,
  "timestamp": "2026-05-25T13:14:15.123987Z",
  "eventType": "evidence_emitted",
  "payload": {
    "evidenceBundleId": "urn:ckodex:evidence:state-abc:0",
    "predicate": "ckodex/skill-lifecycle@v1",
    "subject": "urn:ckodex:state:abc-12345678",
    "policyVersion": "ckodex-skill-lifecycle/v0.2",
    "digest": "sha256:a3f4b8c9d2e1f7090a1b2c3d4e5f6789a3f4b8c9d2e1f7090a1b2c3d4e5f6789"
  },
  "privacyMode": "audit-private"
}
